<?xml version="1.0" encoding='UTF-8'?>
<document_list xmlns:xsi="http://www.w3.org/2001/XMLSchema-instance" xsi:noNamespaceSchemaLocation="scheme.xsd">
	<document id="700012345678912345">
		<type>1</type>
		<number>34-06/234234.01</number>
		<author>Иванов И. И.</author>
		<date>2012-12-13</date>
		<description>
			abcde
		</description>
		<validity>
			<change>
				700012345678912346
			</change>
			<cancel>
				700012345678912349
			</cancel>
		</validity>
		<file_list>
			<file>
				<file_description>
					Приложение
				</file_description>
				<file_name>
					70001234567891234501
				</file_name>
			</file>
			<file>
				<file_description>
					Приложение
				</file_description>
				<file_name>
					70001234567891234502.xml
				</file_name>
			</file>
		</file_list>
	</document>
</document_list>